19190890468,2023-06-06 08:08:04,🟊🟊🟊🟊🟊,航一般运行畅快拍照清晰颜色真的好看，高刷的话，掉电很快，拍照会发烫，续航一般，信号也不是很好 充电也会发烫，手机质感很不错
19149195766,2023-05-26 16:11:07,🟊🟊🟊🟊🟊,物流：自营商品发货速度就是快、配送也及时?;商品：买来送媳妇的，256G D内存，存储空间更大，手机运行速度很顺畅，追剧、游戏都不卡顿，很给力?;拍照清晰，多种模式可以切换，老婆非常喜欢?
19180068602,2023-06-03 18:22:44,🟊🟊🟊🟊🟊,&bull;1暗紫色；256GB;手机非常棒 Apple iPhone 14 Pro (A2892) 256GB;暗紫色 到货非常快 心里一直想换的手机 拍照效果;完美 系统运行丝滑 下载东西飞快 办公室同事看了;也要买 推荐给他们了！
19180058740,2023-06-03 18:21:49,🟊🟊🟊🟊🟊,&bull;盛紫色：256G8;手机非常棒 Apple iPhone 14 Pro (A2$92) 256GB;暗紫色 到货非常快 心里一直想换的手机 拍照效果;完美 系统运行丝滑 下载东西飞快 办公室同事看了;也要买 推荐给他们了！
19178995756,2023-06-03 14:33:51,🟊🟊🟊🟊🟊,用了四年的XR终于换啦 哈哈哈 灵动岛搭配送的六个月apple music超酷的 在出门旅游前拿到新手机强迫症表示很满意！再战四年
19154285039,2023-05-28 07:44:54,🟊🟊🟊🟊🟊,还是苹果手机给力，拍照和手感不错，特别是安全第一，没有那么多的乱七八糟的app，另外，iso的用户体验做的好，希望电池可以更加给力。吐槽一句，没有充电器！
19156802550,2023-05-28 19:29:27,🟊🟊🟊🟊🟊,好用！真的好用！特别是从安卓换到了苹果了，上个苹果机还是10，到了14也没有觉得不适应，主要就是咱也上岛了！物流也超级快。
19136448660,2023-05-22 19:13:28,🟊🟊🟊🟊🟊,考虑好久才买的苹果 14，结婚 15 周年买给老婆的。 手机非常不错，可以说这个灵动岛太好玩了，越来越多的 APP 支持上岛，手感的话很不错，但是稍重了一些拿在手里还是很有分量的，但是这种高级感不是普通手机能能比的，京东物流很快上午拍下午就到了。
19118764251,2023-05-17 07:54:29,🟊🟊🟊🟊🟊,很不错的手机，第一次在京东买手机，体验很不错，次日就到了。会推荐给朋友购买的。京东plus会员用了很久了，也挺不错的。
19149014043,2023-05-26 15:17:01,🟊🟊🟊🟊🟊,苹果手机很好用，性价比很高，尤其摄像功能较为突出，系统也没有卡顿，苹果14还是首选机器拍照录像都是比较优秀的。
19174478723,2023-06-02 14:50:20,🟊🟊🟊🟊🟊,商品收到了，包装得很好，物流非常快，银色颜值夜班高，贵是贵点自营的品质还是值得信赖的，非常好一分钱一分货，总体来说非常满意！
19167921058,2023-05-31 23:23:25,🟊🟊🟊🟊🟊,一次非常满意的购物，从包装配送开始。经典的京东纸盒，内加防震气垫，可以说是非常用心了。手机没什么问题，买来给女朋友小A这几个月过渡一下用，很满意的购物体验。
19154104151,2023-05-28 01:47:09,🟊🟊🟊🟊🟊,手机怎么太棒了，非常非常的喜欢，续航和性能各个方面都太好了，颜值又高质量又非常好，下次有需要会继续回购的。
19155122159,2023-05-28 12:25:14,🟊🟊🟊🟊🟊,苹果的外观和做工就不用提了，一如既往的漂亮和精致，很不错，屏幕音效是P3级别，超级清晰，颜色又正拍照效果，出片一如既往的稳又不花里胡哨，运行速度，快，特别快，应用秒开，很满意
19168986146,2023-06-01 10:37:56,🟊🟊🟊🟊🟊,京东价格就是给力比实体店里便宜好几百大洋，包装好发货快点赞?;外形外观：包装很好无破损;其他特色：快递小哥服务也很棒
19149831167,2023-05-26 19:23:31,🟊🟊🟊🟊🟊,第二天就收到了，无比的开心。送给自己的生日礼物。继续去加油，生活越来越好。开心的一天。之前用的都是安卓，第一次用苹果，还是很上手。????
19167732575,2023-05-31 22:31:03,🟊🟊🟊🟊🟊,iPhone 14 Pro一如既往的完美，4800万像素，使用起来非常丝滑，性价比非常高，值得拥有！
19171742087,2023-06-01 21:26:37,🟊🟊🟊🟊🟊,外形外观：好看;屏幕音效：有提升不明显;拍照效果：非常好;运行速度：流畅;待机时间：提升1-2h;其他特色：颜色很好看;六一礼物很喜欢谢谢老公木啊开心开心
19157134478,2023-05-28 21:03:11,🟊🟊🟊🟊🟊,手机很好。心仪已久，果断下手，用过之后感觉很不错，是正品，裸机手感非常好  快递也很给力，果然名副其实。宝贝收到了，很惊喜，质量非常好，很满意的一次购物。我会继续回购的
19100422875,2023-05-10 22:46:56,🟊🟊🟊🟊🟊,?终于对它下手了，颜值是真的没话说?，材质很好，;官方自营的东西就是好，快递也很快，第二天就到了   用的也放心   目前感觉很不错  用的流畅
19132493811,2023-05-21 15:16:07,🟊🟊🟊🟊🟊,当时买的时候还在犹豫价格，买来之后一点都不后悔，而且物流还快，可以入手外观设计漂亮，尺寸大小合适，包装仔细完整，宝贝手感不错，感觉很好，发货速度快，服务态度一流，给力！5星好评！
19125267899,2023-05-19 08:54:00,🟊🟊🟊🟊🟊,宝贝收到啦，实物真的好看，价格非常实惠，强烈推荐这款，超级喜欢?商品收到了，包装得很好，物流非常快，客服态度很积极，有问题及时解答！总体来说非常满意
19190912904,2023-06-06 08:17:24,🟊🟊🟊🟊🟊,实物与描述的一样，质量相当好，卖家态度也好，有问必答，发货速度杠杠的，值得购买哦;手机几乎每年都会在京东买，质量保证，价格实惠，物品一如既往的好
19157692655,2023-05-29 01:38:25,🟊🟊🟊🟊🟊,外形外观：外观小巧便携，适合手小的单手操作。;屏幕音效：屏幕看着很舒服，音质没的说。;拍照效果：三摄浴霸就很强。;运行速度：A16处理器加上120赫兹很强。;待机时间：轻度使用一天一充够吧。;其他特色：除了贵点，信号差点，续航差点，没什么别的毛病。
19189289594,2023-06-05 18:51:00,🟊🟊🟊🟊🟊,外形外观：这代设计不错比之前的11窄些，;屏幕音效：流畅，肉眼可见的流畅，;拍照效果：苹果拍照就那样吧;运行速度：快！！！;待机时间：一半，不怎么用1天一充
19183267068,2023-06-04 13:26:03,🟊🟊🟊🟊🟊,xr用了快4年太慢了也等不及新品发布了，颜色如图很喜欢，所以买了透明的壳子。****，也没啥换手机的新鲜感了，就是一个工作日常使用的工具。重量还是有的，比较重一些，灵动岛比较好玩这个比较新鲜，拍照比xr好了很多倍，使用也比旧手机快多了，内存也换了大内存都赶上电脑了;外形外观：我喜欢的紫色;屏幕音效：屏幕可以，音效有啥特色吗;拍照效果：杠杠的;运行速度：快;待机时间：一天
19178557531,2023-06-03 12:58:31,🟊🟊🟊🟊🟊,外形外观：可以，挺适合的;屏幕音效：还阔以;拍照效果：拍照苹果还是可以的;运行速度：杠杠的;待机时间：一天一充，时间长了不清楚;其他特色：充电会很烫，不知道是不是夏天原因
19130024151,2023-05-20 18:12:23,🟊🟊🟊🟊🟊,外形外观：Apple的外形不必多说;屏幕音效：顶级;拍照效果：这也不必多说;运行速度：流畅度更是不必多说;待机时间：这个倒是可以说下，电池容量确实让待机时间没有那么长，但是个人来说足以，一天也就用三四十的电;其他特色：仿生芯片和普通芯片的区别吧，给人的感觉是不一样的
19178258279,2023-06-03 11:55:58,🟊🟊🟊🟊🟊,大小合适，比Max轻不少，一只手拿着也不沉，而且我觉得pro比max的边框看起来更窄一些，银色版黑边外面是一层银框，视觉上看起来更舒服一点。在店里看了其他暗色的，确实没有银框看起来舒服。续航方面，不玩游戏一天使用九小时也不是问题。120hz刷新很舒服，系统不卡顿。
19163538534,2023-05-30 19:13:35,🟊🟊🟊🟊🟊,用了几天谈下感受，拿到机子，首先官网查了下确实是未激活的新机，安心。。。;拍照稳准狠，色彩一如既往的准确。抬机即开，人脸识别不拖泥带水。Pro的手感不错，大小合适，单手操作也轻松。系统流畅，灵动岛有点意思，唯一不足的是电池续航能力一般。
19154838215,2023-05-28 11:05:46,🟊🟊🟊🟊🟊,逛了好几天了，决定京东下单，拼多多不敢，怕有问题，昨天收到手机就检查了检查，挺好的，序列号也查了，目前用着没毛病？有问题后续追评，我是真人哦！不是**的哈哈哈?，注意买手机收到货了，别开机先检查外观瑕疵，有瑕疵可以换！开机就不能换了！目前知道的
19191481051,2023-06-06 10:42:58,🟊🟊🟊🟊,人生第一部自己买的iPhone ，很开心，很喜欢。;用了一个星期，总的来说，收到消息还是比较慢，续航不是很长，一天充两三次吧，因为我是充到八十就拔了，四十就充。还可以，拍照好看。;客服态度不错得
19181855476,2023-06-04 07:55:55,🟊🟊🟊🟊🟊,录了开箱视频，没一点问题，比百亿补贴贵了三百多，主要是放心，618，7299入手，返3000京豆，已经是自营店买的第二部苹果手机了，质量有保障
19193108217,2023-06-06 17:03:18,🟊🟊🟊🟊🟊,14pro战斗机，256内存刚刚好，用了一辈子苹果了，一如即往的支持，不是不支持国产，是苹果系统确实优秀确实硬，
19151142498,2023-05-27 08:28:58,🟊🟊🟊🟊🟊,手机收到了挺好用的，价格也合适，不知道耐不耐用，希望能用个3年几年的，到时候再换，拍照效果挺好的，电池也耐用真不错
19153331587,2023-05-27 19:59:53,🟊🟊🟊🟊🟊,外形外观：还可以;屏幕音效：不常用;拍照效果：比安卓机要真实一些，但感觉清晰度提升不大;运行速度：新机没装几个软件目前还是顺畅的;待机时间：旧手机的应用还没挪过来，这台只当备用机。目前只安装了几个社交与出行的应用，用了两天还有一半的电;其他特色：尺寸比我之前的小米11U小了一点，但却一样重
19177922466,2023-06-03 10:49:53,🟊🟊🟊🟊🟊,拍照效果：这个确实不错，苹果拍照一直很讨喜;运行速度：A15处理器目前最强大;待机时间：一天一充吧;屏幕音效：颜色显示细腻，自适应屏幕
19185611683,2023-06-04 21:41:19,🟊🟊🟊🟊🟊,1. 非常漂亮的设计，外观极具吸引力。;2. 摄像头和屏幕都非常棒，视觉效果很出色。;3. 性能十分强大，能够轻松应对多任务处理。;4. 通过iOS手势来控制音量和静音的方式非常优秀。;5. 电池续航能力较好，即使长时间使用也非常耐用。;6. 支持5G网络和MagSafe无线充电，体验更加便捷。;7. 相比前代产品，14 Pro的面板更加坚韧耐用，抗划性能更胜一筹。
19128644099,2023-05-20 10:45:54,🟊🟊🟊🟊🟊,外形外观：外观设计风格非常好看;屏幕音效：屏幕清晰音效收听好;拍照效果：拍照效果逼真清晰;运行速度：运行速度快
19117715523,2023-05-16 19:21:48,🟊🟊🟊🟊🟊,太惊艳了，金属质感让我仿佛回到了乔布斯时代。特别轻薄，而且拿起来非常舒服不割手。目前还在备份icloud，很明显感觉到速度快乐很多，不愧是6g内存。
19090835674,2023-05-07 18:38:53,🟊🟊🟊🟊🟊,手机感观非常好，运行非常流畅！;超级可爱的小灵动岛，;屏幕音效：超级好，个人很爱唱歌，所以很喜欢这个手机的音效质感！！;很爱很爱
19137017993,2023-05-22 22:07:06,🟊🟊🟊🟊🟊,京东效率勿用评述了，晚上下单，一早就到手了。机子流畅，数据资料转换极方便，老手机靠近就能搞定?待机和信号再用一段时间评述。很满意的体验！验机通过，激活也很方便。
19190586362,2023-06-06 00:55:45,🟊🟊🟊🟊🟊,质量也太好了吧 我用了一个周了 是正品 拍照也是yyds流畅性;很好 服务态度也很好 物流也快喜欢的亲们可以直接冲了通信;音质：也很好 买回来就试了
19112243203,2023-05-15 01:38:27,🟊🟊🟊🟊🟊,京东快递非常快，当天就收到了，是苹果官方京东自营店，已验货，全新国行正品机，外观无划痕等，包装完好，不错的购物体验?
19189651988,2023-06-05 20:12:53,🟊🟊🟊🟊🟊,非常好;外形外观：完美;屏幕音效：优秀;拍照效果：真实;运行速度：较快;待机时间：很长;其他特色：待发掘。
19187699689,2023-06-05 12:43:52,🟊🟊🟊🟊🟊,注意，先检查外包装上的序列号在官网上查询！比对好了在拆！ 拆开之后打开手机，也是先不激活，点击右下角的?！继续比对序列号！这时候序列号和外包装上一致就可以激活了！
19093450917,2023-05-08 16:54:17,🟊🟊🟊🟊🟊,很好看！！满怀期待了两天 只是觉得发货有点慢说没有货 但是晚上十点半发货 第二天九点就到了 速度还是很快滴 不错不错爱了～
19175322631,2023-06-02 17:56:34,🟊🟊🟊🟊🟊,外形外观：外观大气上档次，非常漂亮，辨识度高！;屏幕音效：屏幕显示效果非常不错。;拍照效果：拍照挺清晰的，就是拍的照片不好看。;运行速度：手机运行速度流畅，丝滑。;最好的是物流，速度超级快！
19166879967,2023-05-31 19:18:44,🟊🟊🟊🟊🟊,外形外观：外观挺适合，挺漂亮的，手感很好;屏幕音效：屏幕很流畅，音质挺好，挺不错;拍照效果：拍照效果很清晰;运行速度：运行速度很流畅很快，很舒服啊;待机时间：待机时间一天够用;其他特色：第一次用苹果手机，刚从安卓换成苹果，还是用不是那么习惯，用几天了就慢慢习惯了，挺好，挺漂亮，外观可以，，。
19168056057,2023-06-01 00:18:00,🟊🟊🟊🟊🟊,外形外观：黑色非常好;屏幕音效：滑动起来之丝滑;拍照效果：跟之前的比起来简直是上了山顶;运行速度：太快了简直是。之前的七用了六年多。;待机时间：目前一天一冲，用的macpro的充电头。没买配件。。;其他特色：大小刚合适。用起来手不痛，有点重。
19170355992,2023-06-01 16:16:01,🟊🟊🟊🟊🟊,外形外观：尺寸大小刚刚好，没有一点瑕疵，颜色漂亮;屏幕音效：屏幕素质很高，显示清晰，音效高级，双扬声器，音质细腻;拍照效果：4800w像素加iOS运算照片正式还原，所见即所得，记录生活中的精彩的瞬间;运行速度：搭载A16满血版CPU，运行速度飞快，高功率运行的同时功耗又低，都得利于由4**处理器的功耗控制！强大的A16搭配拥有iPhone最大6G运存，运行各大软件快速响应的同时又不容易杀后台！;待机时间：待机时间很长，3200mah容量，得利于A16处理器的功耗控制，中度使用一天一充即可，毫无电量焦虑;其他特色：pro系列搭载激光雷达聚焦速度更快，夜景拍摄能力很强，自动图像防抖拍摄运动视频，细节精准呈现&hellip;总之懂得都懂，多的我就不说啦，虽然只是我老婆的手机，但是我也很羡慕哈哈哈
19153785369,2023-05-27 22:26:38,🟊🟊🟊🟊🟊,外形外观：很经典，以前4时候的造型，宽大了一点;屏幕音效：放音乐，音效不错;拍照效果：苹果手机之前见识过夜间拍照效果很棒，这次14 pro更是4800万啥的效果，后面直接变三摄;运行速度：一如既往的流畅，视频看了好多第一次的使用经验;待机时间：有待观察，把该关的都关了;其他特色：材质顶级，大小合适，品牌力强，终究还是买了苹果手机了
19184280794,2023-06-04 17:07:17,🟊🟊🟊🟊🟊,手感真的一级棒，比iPhone12手感重了好多，续航不打游戏的话两天一充，续航比12真的长了好久。银色真的好好看，我一直在银色和黑色之间纠结了好久，选银色真的无敌爆炸好看;拍照效果：拍照效果我感觉提升的并不明显，毕竟苹果也不是主打拍照的手机，这个我倒是不介意;运行速度：运行速度杠杠的，618买它没错
19147103260,2023-05-25 22:23:55,🟊🟊🟊🟊🟊,用了有一段时间了！;外形外观：外观十分nice！;屏幕音效：音效着实不错！;拍照效果：拍照效果很nice！有4k的录制和拍摄效果可以调！;运行速度：运行速度很不nice！;待机时间：待机时间还可以吧！
19155181927,2023-05-28 12:43:35,🟊🟊🟊🟊🟊,超级好用，待机时间长，用快充充电很快，好用;手感也很好哦，;外形外观：好看;屏幕音效：不错;拍照效果：真的很好吧，我拍照技术很不好还是能拍出好看一点的;待机时间：长;运行速度：快;值得推荐
19156911503,2023-05-28 19:58:52,🟊🟊🟊🟊🟊,外形外观：手感好，比Max拿起来舒服。;屏幕音效：水果出品，品质一流。;拍照效果：不太拍照，对我来说够用了。;运行速度：运行非常流畅自然。;待机时间：使用不频繁，待机时间完全够用。;其他特色：好看好看
19148722042,2023-05-26 13:43:51,🟊🟊🟊🟊🟊,外形外观：非常大气上档次;屏幕音效：没有瑕疵;拍照效果：效果杠杠的&hellip;;运行速度：速度超过博尔特;待机时间：比老年机差点;其他特色：就是好就是棒&hellip;&hellip;&hellip;&hellip;
19164173450,2023-05-30 22:25:49,🟊🟊🟊🟊🟊,价格合适，拍照很好看，电池容量很大，;外形外观：外观不错;屏幕音效：音质很好;拍照效果：很出片;运行速度：很快;值得购买;??了
19157132932,2023-05-28 21:01:25,🟊🟊🟊🟊🟊,外形外观：颜色很正，很显高档，不锈钢边框手感非常好;屏幕音效：高刷屏幕刷网页很跟手;拍照效果：还原度很高，尤其是夜景，非常惊艳;运行速度：非常快，满足日常一切所需;待机时间：新机子待机没问题
19182759920,2023-06-04 11:38:10,🟊🟊🟊🟊🟊,这次618京东有活动，加上之前买的iphone13内存128g不够所以就趁着免息活动换了14pro，相比于13来说，我个人觉得最大的提升在于高刷，之前在直营店体验新机没觉得有啥区别，实际上手流畅很多。其次摄像头影像提升和灵动岛的加入也是优点，整体续航没多大变化。新机配送是同城商场授权店配送的，晚上下单隔天上午就到，速度很快，机器也无瑕疵，安全下车，给京东点个赞~
19182852968,2023-06-04 11:59:00,🟊🟊🟊🟊🟊,外形外观：扁平化边框和圆形伸缩摄像头的设计，整体感觉更显精致高级。去掉了闪光灯凸起，使得机身更加平滑光滑，让整个后盖区域更加完美，质感更加出众。;拍照效果：主摄像头4800万像素分辨率，提供了清晰的图像质量，加上超广角摄像头，使照片看起来更自然。另外在颜色，曝光，锐化方面也具有更好的灵活性。;运行速度：全新的A16 仿生芯片，拥有强大的计算和图形处理功能，手机运行非常流畅。;屏幕音效：6.1英寸的超视网膜XDR显示屏幕，分辨率为2556 x 1179 像素，像素密度高达460ppi。可以享受到极致的视觉体验，所有图像都非常清晰、细腻。120Hz的自适应刷新率显示技术，使得整个屏幕看起来更加平滑、流畅，带来震撼的观影和游戏体验。;待机时间：日常场景下iPhone 14 Pro的电池能够轻松续航一天，如果是比较轻度的使用甚至可以一天半甚至两天。
19162364799,2023-05-30 13:06:58,🟊🟊🟊🟊🟊,现在喜欢苹果的年轻人还是很多啊;帮朋友买的;外形外观：熟悉的外观，颜色大气;屏幕音效：屏幕优秀，音质很棒;拍照效果：色彩还原度高，速度快;运行速度：处理器杠杠滴，性能毋庸置疑;待机时间：待机时间一般，充电稍慢
19169787185,2023-06-01 13:55:08,🟊🟊🟊🟊🟊,外形外观：如图所示，很好看，不锈钢材质很高级;屏幕音效：都挺好的，很清晰，声音也可以的。;拍照效果：挺好用的，无滤镜，很纯粹，很真实;运行速度：挺快的
19163347379,2023-05-30 18:15:05,🟊🟊🟊🟊🟊,外形外观：外观很完美 暗紫色非常好看;屏幕音效：屏幕显示效果极佳;拍照效果：拍照很好 录像非常棒;运行速度：运行速度很快 使用很好
19183831130,2023-06-04 15:33:56,🟊🟊🟊🟊🟊,外形外观：非常完美，喜欢这个颜色。;屏幕音效：音质非常好。;拍照效果：清楚好看。;目前没啥问题，看看后续什么情况吧！
19153390730,2023-05-27 20:15:08,🟊🟊🟊🟊🟊,外形外观：暗夜紫的颜色真的是很漂亮，手感顶级丝滑;屏幕音效：屏幕亮度提升了很多，120Hz的高刷很爽;拍照效果：后置4800像素提升明显;运行速度：ios系统运行流畅，A16的处理机吊打很多机器了，电池容量也提升了，不深度使用基本上一天一充即可。
19168768613,2023-06-01 09:47:55,🟊🟊🟊🟊🟊,外形外观：超好看;屏幕音效：棒棒棒;拍照效果：不错照亮我的丑;运行速度：可以;待机时间：可以;其他特色：音效真的是好;第一次用苹果银色决绝子太好看了吧
19150129337,2023-05-26 20:55:46,🟊🟊🟊🟊🟊,外观太好看了，非常喜欢这个后置摄像头！屏幕音效也清晰！拍照非常的清楚，直接原图像一模一样。运行速度很给力，超乎想象！物流也太快了 只用了一天的时间，包装也很好！点赞！?
19160295398,2023-05-29 19:55:32,🟊🟊🟊🟊🟊,外形外观：完美无瑕。;屏幕音效：背景飘亮。色差非常好，相片画面逼真，非常有质感。;拍照效果：色差非常好，相片画逼真，非常有质感。;运行速度：非常快，A16CPU名不虚传。;待机时间：未知，一段时间后再评。
19178190069,2023-06-03 11:42:35,🟊🟊🟊🟊🟊,外形外观：很好非常喜欢，外观很好看非常漂亮;屏幕音效：音质很清晰，屏幕很大很清楚;拍照效果：拍照非常好，很喜欢，买了他拍照就有自信了;运行速度：运行时间很好，待机时间长;待机时间：待机时间长;其他特色：总体说很好，非常漂亮，推荐购买
19169349342,2023-06-01 12:00:07,🟊🟊🟊🟊🟊,14pro使用后体验极佳，运行流畅，A16处理器续航提升很大，4800万像素拍照清晰，特别是视频拍摄，防抖功能是安卓无法比的，屏幕素质也是目前手机中最顶级的，工艺设计美观，快递速度快。
19139924912,2023-05-23 20:42:37,🟊🟊🟊🟊🟊,外形外观：外形外观：外观非常漂亮，做工精细，质量非常好，无划痕，完美。;屏幕音效：屏幕清晰，音质很好，音质清晰。;拍照效果：非常清晰，拍照很清晰，拍照效果很好，尤其夜间拍摄，进步很大。;运行速度：运行速度很快，很流畅，目前没有出现问题。;待机时间：还可以，不玩游戏，大概能一天一充。;其他特色：整体不错。
19174150184,2023-06-02 13:32:20,🟊🟊🟊🟊🟊,外形外观：大气上档次  送人 值得优先选择;屏幕音效：反应快  音质佳;拍照效果：清晰度很高;运行速度：快  打游戏流畅  追剧不二志选;待机时间：一般
19184057624,2023-06-04 16:21:26,🟊🟊🟊🟊🟊,外形外观：真好，真想机，颜值在线;屏幕音效：屏幕顺畅，音效也可;拍照效果：像素高，苹果机的原相机赞;运行速度：运行流畅;待机时间：新机满电一天够用很高
19160579052,2023-05-29 21:11:08,🟊🟊🟊🟊🟊,前天就收到了宝贝，用了两天才来评价的，快递真的快，小哥态度也很好，包装很好，机器也是很完美，做工啊，都很好，从iPhone 11换过来得很舒服
19152490552,2023-05-27 15:35:08,🟊🟊🟊🟊🟊,真的太好了苹果。爱了爱了。爱死了。iphone我的最爱。就是第一次注册麻烦一些其他都可以。后面不会再用安卓手机的就是个垃圾。还是ios系统好用很不错。;拍照效果：非常清晰。很好
19180531921,2023-06-03 20:05:30,🟊🟊🟊🟊🟊,配送速度很快 第二天就到了 大小刚刚好 正品新机 无瑕疵 没有任何问题目前;外形外观：非常好看 很喜欢 颜色很喜欢 用什么手机壳都好看;屏幕音效：好;拍照效果：拍照效果绝绝子 就是喜欢它拍照的效果;运行速度：快;待机时间：长 并没有别人说的续航不好 用了这么多天续航可以用一天 一天只需要冲一次 充满了可以用到第二天下午
