19177018654,2023-06-03 02:13:07,,外形外观：紫色骚气不失沉稳，真是好看;屏幕音效：屏幕纯净丝滑，像女友的大腿，音效也很奈斯;拍照效果：普通模式也完全够用，清晰，如图拍照还是不错的;运行速度：前所未有的流畅;待机时间：电池怎么说呢，有时候感觉很耐用，有时候掉电有很快，有待加强;其他特色：第一次在京东买手机，体验很不错，妥妥的迅速，有保障。我家咪咪让我给个五星好评
19154730197,2023-05-28 10:34:03,,外形外观：喜欢?，盯了很久了;屏幕音效：完美，试了跟踪音效，不错;拍照效果：三摄还是好呀;运行速度：快就一个字;待机时间：没试出来呢，才用了一天;看了很长时间了，终于在苹果自营店购买了。快递速度真是快呀，下单后半小时就送到了。点个赞。开机串码什么都正常，点个赞。哈哈?，确实很不错哦。苹果自营店，信得过。视频加了手机壳的。
19131370132,2023-05-21 09:24:20,,外形外观：大气，手感好，轻，;屏幕音效：声音大，音质浑厚，;拍照效果：一流，特别清晰，;运行速度：流畅，非常流畅，特别流畅，;待机时间：一整天，根本用不完，;其他特色：好看，白色漂亮，充电快，
19165468190,2023-05-31 11:59:33,,安全下车，还是黑色最帅最耐看，新机子果然不一样，拍照很高清，苹果就是流畅，哈哈，喜欢不出问题，;屏幕音效：超级棒，运行速度快。
19139062318,2023-05-23 16:11:44,,安全下车！！！！;外形外观：好看?白色！！！;拍照效果：非常好！;运行速度：很快，比安卓快;其他特色：看我开箱视频;待机时间：没有任何问题
19114966848,2023-05-15 21:39:54,,"外形外观:苹果的风格，硬朗，角明显，紫色很好看;;屏幕音效:显示清晰细腻，音质好元噪音，音量正常;;拍照效果:拍照效果很好，照片质量很好;;运行速度:运行反应速度灵敏;;待机时间:待机非常给力，;;其他特色:苹果的系统，用着省心，京东自营质量;;有保障,物流非常给力,快递员服务态度非常好"
19152600490,2023-05-27 16:11:57,,拍照清晰续航很好运行畅快;趁着降价入了 iPhone 14 Pro ，暗夜紫，上手感觉非常不错 在光线稍微暗的地方，这个紫色看起来就和暗黑色，非常好看，变色的感觉也挺别致。
19161277613,2023-05-30 06:27:23,,外形外观：外形外观很好看，苹果一流的设计简直不要太好看了吧，拿在手上有范亮眼！！！简直是绝了;屏幕音效：屏幕好清晰感觉比2k还好，丝滑顺畅;拍照效果：拍照很好看，画质贼好，一如既往的66666;运行速度：毫无压力啊！大型游戏随便上，根本不带卡的;待机时间：待机时间很长，很不错，电池大吧
19173600344,2023-06-02 11:31:01,,"外形外观：外观简约大气上档次，低调奢华有内涵。;屏幕音效：音质舒服，音效很不错。;拍照效果：长焦拍照效果惊喜，4800W像素超级能打，照片看着就很有质感。;运行速度：不错;待机时间：电池续航能力强，待机时间长，基本一天一充，不玩游戏什么的电量足够了。;其他特色：想升级手机，喜欢拍照的推荐14pro,拍照效果杠杠的。"
19158146550,2023-05-29 09:39:33,,外形外观：外形尺寸大小合适，外观漂亮大气上档次??;屏幕音效：屏幕显示效果很好，色彩鲜艳，很细腻！;拍照效果：拍照杠杠的，各种功能太多了！;运行速度：运行速度很快。果机的强项！;待机时间：待机一天左右吧
19171064316,2023-06-01 19:03:04,,给媳妇买的14pro  手感大小刚刚好，白色适合女生用，618价格还算满意，京东物流还是一如既往的快，第二天就到了。整体满意;屏幕音效：这代pro屏幕真心不错，激发亮度也很高  室外也看着不费眼。苹果的音效还是杠杠的  双扬声器的效果不错;拍照效果：一般，自然 但不好看。录像很好;运行速度：顺滑，不玩游戏够用。;待机时间：一般般，轻度使用勉强一天吧
19153527456,2023-05-27 21:00:42,,Jo;拍照效果：很棒的，手机会自动根;据不同环境会补光 电池续航：快;速充电，通信音质：很好的，音质;不错的 运行速度：很快的，不卡;顿 显示效果：处理器是很好的;赞！iPhone 有一点厚，游戏运行也;不错，其他都不;错，;，真心评价。值得拥有 拍照效;果：很清晰的，很适合拍照;值得推荐
19094420035,2023-05-08 22:20:29,,方便快捷，价格透明。;外形外观：时尚耐看，喜欢灵动岛的造型！;屏幕音效：音箱声音很大，而且效果提升不少？;拍照效果：拍照清晰了，像素提高了很多！
19098139294,2023-05-10 09:53:45,,外形外观：苹果的外观和做工就不用提了，一如既往的漂亮和精致;屏幕音效：P3 级别，超级清晰，颜色又正;拍照效果：出片一如既往的稳又不花里胡哨;运行速度：快，特别快，应用秒开;其他特色：贵
19127725410,2023-05-19 22:26:08,,外形外观：很好看;屏幕音效：杠杠滴;拍照效果：很清晰;运行速度：很快;待机时间：很长;其他特色：价格很实惠 有点低音炮的感觉 非常给力 非常喜欢
19095964066,2023-05-09 14:18:10,,安全下车 很给力的 第一次用苹果 界面和流畅度都很不错;外形外观：暗紫色嘎嘎帅;拍照效果：很清晰;运行速度：很流畅;屏幕音效：苹果特色
19155115677,2023-05-28 12:23:41,,苹果的外观和做工就不用提了，一如既往的漂亮和精致;屏幕音效，P3级别，超级清晰，颜色又正拍照效果，出片一如既往的稳又不花里胡哨，运行速度快，特别快，应用秒开，很不错
19131645304,2023-05-21 10:51:46,,外形外观：打破了传统的刘海设计，不锈钢边框具有很高的抗氧化性和抗腐蚀性，耐用。;屏幕音效：超视网膜显示屏，120HZ自适应刷新技术，使画面更加流畅自然。;剩下的继续体验以后再说
19179994130,2023-06-03 18:07:30,,纯正原装;外形外观：毫无瑕疵哦;屏幕音效：依然还是很不错的;拍照效果：就是苹果像素;运行速度：哇哇叫，没毛病;待机时间：足够一天玩耍了！！！
19096936329,2023-05-09 19:47:27,,非常漂亮的一款手机！颜值超高！下单后一度担心会不会收到差评里出现的机子，拿到后终于放下心来。外观没有瑕疵，20分钟将旧手机里的一切转移至新手机，立即可以使用了。超棒！五星好评！
19173911308,2023-06-02 12:40:08,,趁着618京东活动，给全家都换新手机，价格优惠入手。总体评价方便快捷，价格透明。;外形外观：时尚耐看，喜欢灵动岛的造型！;屏幕音效：音箱声音很大，而且效果提升不少;拍照效果：拍照清晰了，像素提高了很多
19112491237,2023-05-15 08:36:07,,这个黑色太喜欢了，比13午夜黑好看，有手感，再自营买了五六个手机了，非常棒，14p系列相当可以。使用感受得看，总之手感很不错，
19147474691,2023-05-26 04:36:12,,续航一般运行畅快拍照清晰颜色真的好看，高刷的话，掉电很快，拍照会发烫，续航一般，信号也不是很好，充电也会发烫，手机质感很不错
19170457042,2023-06-01 16:41:07,,这个颜色超级爱呀，设计感很强，尺寸大小刚刚好，手感很舒适，屏幕很高清，音效也清晰，高音不刺耳，低音也很清晰，拍照更是没得说，清晰度非常高，运行速度很快，玩游戏一点不卡壳，充电很快，充上电用一天没问题。一款颜值和性价比双高的手机
19167067063,2023-05-31 20:09:49,,外形外观：大小刚刚合适，拿着很方便，金色yyds;屏幕音效：很清楚;拍照效果：拍照非常好看，清楚， 也有放大镜功能哈哈哈哈哈哈，很实用。;运行速度：很快，很丝滑哈哈哈;待机时间：一天经常玩手机，可以用一天
19143300099,2023-05-24 20:42:37,,外形外观：外观非常好看。很喜欢这种边框设计。后背磨砂很有质感。;屏幕音效：显示更清楚。原彩显示也很舒服。;拍照效果：拍照很ok。;运行速度：a16运行更快。;待机时间：用一天还剩30左右。正合适。以后掉了点电也刚刚好。;还有京东快递也很迅速。很喜欢在京东买东西。快。售后也好。拆开包装没灰。很舒服。没中奖
19089984687,2023-05-07 13:57:36,,Apple iPhone 14 Pro (A2892) 128GB 银色 支持移动联通电信5G 双卡双待手机不用再拿两个手机了，苹果的相机比安卓好很多，手机很流畅。
19090751527,2023-05-07 18:12:30,,新机买回来，第一件事上了个保护套，手握感很舒服，运行速度快，照相效果非常棒&hellip;&hellip;
19190890468,2023-06-06 08:08:04,,航一般运行畅快拍照清晰颜色真的好看，高刷的话，掉电很快，拍照会发烫，续航一般，信号也不是很好 充电也会发烫，手机质感很不错
19149195766,2023-05-26 16:11:07,,物流：自营商品发货速度就是快、配送也及时?;商品：买来送媳妇的，256G D内存，存储空间更大，手机运行速度很顺畅，追剧、游戏都不卡顿，很给力?;拍照清晰，多种模式可以切换，老婆非常喜欢?
19180068602,2023-06-03 18:22:44,,&bull;1暗紫色；256GB;手机非常棒 Apple iPhone 14 Pro (A2892) 256GB;暗紫色 到货非常快 心里一直想换的手机 拍照效果;完美 系统运行丝滑 下载东西飞快 办公室同事看了;也要买 推荐给他们了！
19180058740,2023-06-03 18:21:49,,&bull;盛紫色：256G8;手机非常棒 Apple iPhone 14 Pro (A2$92) 256GB;暗紫色 到货非常快 心里一直想换的手机 拍照效果;完美 系统运行丝滑 下载东西飞快 办公室同事看了;也要买 推荐给他们了！
19178995756,2023-06-03 14:33:51,,用了四年的XR终于换啦 哈哈哈 灵动岛搭配送的六个月apple music超酷的 在出门旅游前拿到新手机强迫症表示很满意！再战四年
19154285039,2023-05-28 07:44:54,,还是苹果手机给力，拍照和手感不错，特别是安全第一，没有那么多的乱七八糟的app，另外，iso的用户体验做的好，希望电池可以更加给力。吐槽一句，没有充电器！
19156802550,2023-05-28 19:29:27,,好用！真的好用！特别是从安卓换到了苹果了，上个苹果机还是10，到了14也没有觉得不适应，主要就是咱也上岛了！物流也超级快。
19136448660,2023-05-22 19:13:28,,考虑好久才买的苹果 14，结婚 15 周年买给老婆的。 手机非常不错，可以说这个灵动岛太好玩了，越来越多的 APP 支持上岛，手感的话很不错，但是稍重了一些拿在手里还是很有分量的，但是这种高级感不是普通手机能能比的，京东物流很快上午拍下午就到了。
19118764251,2023-05-17 07:54:29,,很不错的手机，第一次在京东买手机，体验很不错，次日就到了。会推荐给朋友购买的。京东plus会员用了很久了，也挺不错的。
19149014043,2023-05-26 15:17:01,,苹果手机很好用，性价比很高，尤其摄像功能较为突出，系统也没有卡顿，苹果14还是首选机器拍照录像都是比较优秀的。
19174478723,2023-06-02 14:50:20,,商品收到了，包装得很好，物流非常快，银色颜值夜班高，贵是贵点自营的品质还是值得信赖的，非常好一分钱一分货，总体来说非常满意！
19167921058,2023-05-31 23:23:25,,一次非常满意的购物，从包装配送开始。经典的京东纸盒，内加防震气垫，可以说是非常用心了。手机没什么问题，买来给女朋友小A这几个月过渡一下用，很满意的购物体验。
19154104151,2023-05-28 01:47:09,,手机怎么太棒了，非常非常的喜欢，续航和性能各个方面都太好了，颜值又高质量又非常好，下次有需要会继续回购的。
19155122159,2023-05-28 12:25:14,,苹果的外观和做工就不用提了，一如既往的漂亮和精致，很不错，屏幕音效是P3级别，超级清晰，颜色又正拍照效果，出片一如既往的稳又不花里胡哨，运行速度，快，特别快，应用秒开，很满意
19168986146,2023-06-01 10:37:56,,京东价格就是给力比实体店里便宜好几百大洋，包装好发货快点赞?;外形外观：包装很好无破损;其他特色：快递小哥服务也很棒
19149831167,2023-05-26 19:23:31,,第二天就收到了，无比的开心。送给自己的生日礼物。继续去加油，生活越来越好。开心的一天。之前用的都是安卓，第一次用苹果，还是很上手。????
19167732575,2023-05-31 22:31:03,,iPhone 14 Pro一如既往的完美，4800万像素，使用起来非常丝滑，性价比非常高，值得拥有！
19171742087,2023-06-01 21:26:37,,外形外观：好看;屏幕音效：有提升不明显;拍照效果：非常好;运行速度：流畅;待机时间：提升1-2h;其他特色：颜色很好看;六一礼物很喜欢谢谢老公木啊开心开心
19157134478,2023-05-28 21:03:11,,手机很好。心仪已久，果断下手，用过之后感觉很不错，是正品，裸机手感非常好  快递也很给力，果然名副其实。宝贝收到了，很惊喜，质量非常好，很满意的一次购物。我会继续回购的
19100422875,2023-05-10 22:46:56,,?终于对它下手了，颜值是真的没话说?，材质很好，;官方自营的东西就是好，快递也很快，第二天就到了   用的也放心   目前感觉很不错  用的流畅
19132493811,2023-05-21 15:16:07,,当时买的时候还在犹豫价格，买来之后一点都不后悔，而且物流还快，可以入手外观设计漂亮，尺寸大小合适，包装仔细完整，宝贝手感不错，感觉很好，发货速度快，服务态度一流，给力！5星好评！
19125267899,2023-05-19 08:54:00,,宝贝收到啦，实物真的好看，价格非常实惠，强烈推荐这款，超级喜欢?商品收到了，包装得很好，物流非常快，客服态度很积极，有问题及时解答！总体来说非常满意
19190912904,2023-06-06 08:17:24,,实物与描述的一样，质量相当好，卖家态度也好，有问必答，发货速度杠杠的，值得购买哦;手机几乎每年都会在京东买，质量保证，价格实惠，物品一如既往的好
19157692655,2023-05-29 01:38:25,,外形外观：外观小巧便携，适合手小的单手操作。;屏幕音效：屏幕看着很舒服，音质没的说。;拍照效果：三摄浴霸就很强。;运行速度：A16处理器加上120赫兹很强。;待机时间：轻度使用一天一充够吧。;其他特色：除了贵点，信号差点，续航差点，没什么别的毛病。
19189289594,2023-06-05 18:51:00,,外形外观：这代设计不错比之前的11窄些，;屏幕音效：流畅，肉眼可见的流畅，;拍照效果：苹果拍照就那样吧;运行速度：快！！！;待机时间：一半，不怎么用1天一充
19183267068,2023-06-04 13:26:03,,xr用了快4年太慢了也等不及新品发布了，颜色如图很喜欢，所以买了透明的壳子。****，也没啥换手机的新鲜感了，就是一个工作日常使用的工具。重量还是有的，比较重一些，灵动岛比较好玩这个比较新鲜，拍照比xr好了很多倍，使用也比旧手机快多了，内存也换了大内存都赶上电脑了;外形外观：我喜欢的紫色;屏幕音效：屏幕可以，音效有啥特色吗;拍照效果：杠杠的;运行速度：快;待机时间：一天
19178557531,2023-06-03 12:58:31,,外形外观：可以，挺适合的;屏幕音效：还阔以;拍照效果：拍照苹果还是可以的;运行速度：杠杠的;待机时间：一天一充，时间长了不清楚;其他特色：充电会很烫，不知道是不是夏天原因
19130024151,2023-05-20 18:12:23,,外形外观：Apple的外形不必多说;屏幕音效：顶级;拍照效果：这也不必多说;运行速度：流畅度更是不必多说;待机时间：这个倒是可以说下，电池容量确实让待机时间没有那么长，但是个人来说足以，一天也就用三四十的电;其他特色：仿生芯片和普通芯片的区别吧，给人的感觉是不一样的
19178258279,2023-06-03 11:55:58,,大小合适，比Max轻不少，一只手拿着也不沉，而且我觉得pro比max的边框看起来更窄一些，银色版黑边外面是一层银框，视觉上看起来更舒服一点。在店里看了其他暗色的，确实没有银框看起来舒服。续航方面，不玩游戏一天使用九小时也不是问题。120hz刷新很舒服，系统不卡顿。
19163538534,2023-05-30 19:13:35,,用了几天谈下感受，拿到机子，首先官网查了下确实是未激活的新机，安心。。。;拍照稳准狠，色彩一如既往的准确。抬机即开，人脸识别不拖泥带水。Pro的手感不错，大小合适，单手操作也轻松。系统流畅，灵动岛有点意思，唯一不足的是电池续航能力一般。
19154838215,2023-05-28 11:05:46,,逛了好几天了，决定京东下单，拼多多不敢，怕有问题，昨天收到手机就检查了检查，挺好的，序列号也查了，目前用着没毛病？有问题后续追评，我是真人哦！不是**的哈哈哈?，注意买手机收到货了，别开机先检查外观瑕疵，有瑕疵可以换！开机就不能换了！目前知道的
19191481051,2023-06-06 10:42:58,,人生第一部自己买的iPhone ，很开心，很喜欢。;用了一个星期，总的来说，收到消息还是比较慢，续航不是很长，一天充两三次吧，因为我是充到八十就拔了，四十就充。还可以，拍照好看。;客服态度不错得
19181855476,2023-06-04 07:55:55,,录了开箱视频，没一点问题，比百亿补贴贵了三百多，主要是放心，618，7299入手，返3000京豆，已经是自营店买的第二部苹果手机了，质量有保障
19193108217,2023-06-06 17:03:18,,14pro战斗机，256内存刚刚好，用了一辈子苹果了，一如即往的支持，不是不支持国产，是苹果系统确实优秀确实硬，
19151142498,2023-05-27 08:28:58,,手机收到了挺好用的，价格也合适，不知道耐不耐用，希望能用个3年几年的，到时候再换，拍照效果挺好的，电池也耐用真不错
19153331587,2023-05-27 19:59:53,,外形外观：还可以;屏幕音效：不常用;拍照效果：比安卓机要真实一些，但感觉清晰度提升不大;运行速度：新机没装几个软件目前还是顺畅的;待机时间：旧手机的应用还没挪过来，这台只当备用机。目前只安装了几个社交与出行的应用，用了两天还有一半的电;其他特色：尺寸比我之前的小米11U小了一点，但却一样重
19177922466,2023-06-03 10:49:53,,拍照效果：这个确实不错，苹果拍照一直很讨喜;运行速度：A15处理器目前最强大;待机时间：一天一充吧;屏幕音效：颜色显示细腻，自适应屏幕
19185611683,2023-06-04 21:41:19,,1. 非常漂亮的设计，外观极具吸引力。;2. 摄像头和屏幕都非常棒，视觉效果很出色。;3. 性能十分强大，能够轻松应对多任务处理。;4. 通过iOS手势来控制音量和静音的方式非常优秀。;5. 电池续航能力较好，即使长时间使用也非常耐用。;6. 支持5G网络和MagSafe无线充电，体验更加便捷。;7. 相比前代产品，14 Pro的面板更加坚韧耐用，抗划性能更胜一筹。
19128644099,2023-05-20 10:45:54,,外形外观：外观设计风格非常好看;屏幕音效：屏幕清晰音效收听好;拍照效果：拍照效果逼真清晰;运行速度：运行速度快
19117715523,2023-05-16 19:21:48,,太惊艳了，金属质感让我仿佛回到了乔布斯时代。特别轻薄，而且拿起来非常舒服不割手。目前还在备份icloud，很明显感觉到速度快乐很多，不愧是6g内存。
19090835674,2023-05-07 18:38:53,,手机感观非常好，运行非常流畅！;超级可爱的小灵动岛，;屏幕音效：超级好，个人很爱唱歌，所以很喜欢这个手机的音效质感！！;很爱很爱
19137017993,2023-05-22 22:07:06,,京东效率勿用评述了，晚上下单，一早就到手了。机子流畅，数据资料转换极方便，老手机靠近就能搞定?待机和信号再用一段时间评述。很满意的体验！验机通过，激活也很方便。
19190586362,2023-06-06 00:55:45,,质量也太好了吧 我用了一个周了 是正品 拍照也是yyds流畅性;很好 服务态度也很好 物流也快喜欢的亲们可以直接冲了通信;音质：也很好 买回来就试了
19112243203,2023-05-15 01:38:27,,京东快递非常快，当天就收到了，是苹果官方京东自营店，已验货，全新国行正品机，外观无划痕等，包装完好，不错的购物体验?
19189651988,2023-06-05 20:12:53,,非常好;外形外观：完美;屏幕音效：优秀;拍照效果：真实;运行速度：较快;待机时间：很长;其他特色：待发掘。
19187699689,2023-06-05 12:43:52,,注意，先检查外包装上的序列号在官网上查询！比对好了在拆！ 拆开之后打开手机，也是先不激活，点击右下角的?！继续比对序列号！这时候序列号和外包装上一致就可以激活了！
19093450917,2023-05-08 16:54:17,,很好看！！满怀期待了两天 只是觉得发货有点慢说没有货 但是晚上十点半发货 第二天九点就到了 速度还是很快滴 不错不错爱了～
19175322631,2023-06-02 17:56:34,,外形外观：外观大气上档次，非常漂亮，辨识度高！;屏幕音效：屏幕显示效果非常不错。;拍照效果：拍照挺清晰的，就是拍的照片不好看。;运行速度：手机运行速度流畅，丝滑。;最好的是物流，速度超级快！
19166879967,2023-05-31 19:18:44,,外形外观：外观挺适合，挺漂亮的，手感很好;屏幕音效：屏幕很流畅，音质挺好，挺不错;拍照效果：拍照效果很清晰;运行速度：运行速度很流畅很快，很舒服啊;待机时间：待机时间一天够用;其他特色：第一次用苹果手机，刚从安卓换成苹果，还是用不是那么习惯，用几天了就慢慢习惯了，挺好，挺漂亮，外观可以，，。
19168056057,2023-06-01 00:18:00,,外形外观：黑色非常好;屏幕音效：滑动起来之丝滑;拍照效果：跟之前的比起来简直是上了山顶;运行速度：太快了简直是。之前的七用了六年多。;待机时间：目前一天一冲，用的macpro的充电头。没买配件。。;其他特色：大小刚合适。用起来手不痛，有点重。
19170355992,2023-06-01 16:16:01,,外形外观：尺寸大小刚刚好，没有一点瑕疵，颜色漂亮;屏幕音效：屏幕素质很高，显示清晰，音效高级，双扬声器，音质细腻;拍照效果：4800w像素加iOS运算照片正式还原，所见即所得，记录生活中的精彩的瞬间;运行速度：搭载A16满血版CPU，运行速度飞快，高功率运行的同时功耗又低，都得利于由4**处理器的功耗控制！强大的A16搭配拥有iPhone最大6G运存，运行各大软件快速响应的同时又不容易杀后台！;待机时间：待机时间很长，3200mah容量，得利于A16处理器的功耗控制，中度使用一天一充即可，毫无电量焦虑;其他特色：pro系列搭载激光雷达聚焦速度更快，夜景拍摄能力很强，自动图像防抖拍摄运动视频，细节精准呈现&hellip;总之懂得都懂，多的我就不说啦，虽然只是我老婆的手机，但是我也很羡慕哈哈哈
19153785369,2023-05-27 22:26:38,,外形外观：很经典，以前4时候的造型，宽大了一点;屏幕音效：放音乐，音效不错;拍照效果：苹果手机之前见识过夜间拍照效果很棒，这次14 pro更是4800万啥的效果，后面直接变三摄;运行速度：一如既往的流畅，视频看了好多第一次的使用经验;待机时间：有待观察，把该关的都关了;其他特色：材质顶级，大小合适，品牌力强，终究还是买了苹果手机了
19184280794,2023-06-04 17:07:17,,手感真的一级棒，比iPhone12手感重了好多，续航不打游戏的话两天一充，续航比12真的长了好久。银色真的好好看，我一直在银色和黑色之间纠结了好久，选银色真的无敌爆炸好看;拍照效果：拍照效果我感觉提升的并不明显，毕竟苹果也不是主打拍照的手机，这个我倒是不介意;运行速度：运行速度杠杠的，618买它没错
19147103260,2023-05-25 22:23:55,,用了有一段时间了！;外形外观：外观十分nice！;屏幕音效：音效着实不错！;拍照效果：拍照效果很nice！有4k的录制和拍摄效果可以调！;运行速度：运行速度很不nice！;待机时间：待机时间还可以吧！
19155181927,2023-05-28 12:43:35,,超级好用，待机时间长，用快充充电很快，好用;手感也很好哦，;外形外观：好看;屏幕音效：不错;拍照效果：真的很好吧，我拍照技术很不好还是能拍出好看一点的;待机时间：长;运行速度：快;值得推荐
19156911503,2023-05-28 19:58:52,,外形外观：手感好，比Max拿起来舒服。;屏幕音效：水果出品，品质一流。;拍照效果：不太拍照，对我来说够用了。;运行速度：运行非常流畅自然。;待机时间：使用不频繁，待机时间完全够用。;其他特色：好看好看
