19150012617,2023-05-26 20:19:37,🟊🟊🟊🟊🟊,iPhone14Pro暗紫色采用了全新的设计语言，整体外观更加简洁、流畅，同时也更加美观。手机背面采用了磨砂玻璃材质，手感非常舒适，同时也不容易留下指纹和污渍。而且，这款手机的暗紫色非常漂亮，给人一种高贵、优雅的感觉。性能方面，iPhone14Pro采用了全新的A17芯片，性能比上一代提升了30%，同时也支持5G网络，下载速度非常快。而且，这款手机的屏幕也非常出色，采用了全新的OLED屏幕技术，色彩更加鲜艳、清晰，同时也支持120Hz刷新率，使用起来非常流畅。
19168186545,2023-06-01 02:37:08,🟊🟊🟊🟊🟊,安全下车，京东物流果然很快。序列号没问题，外观全新无磕碰无划痕，扬声器和摄像头也都正常。显示效果：正常通信音质：正常其他特色：灵动岛用着也就那样，胶囊屏仍需打磨，期待屏下摄像头。
19112279405,2023-05-15 04:00:58,🟊🟊🟊🟊🟊,外观设计非常出色，质感高级，握在手中非常舒适。性能强大，搭载最新A16仿生芯片，配合iOS 系统，流畅度和稳定性都非常出色。拍照功能同样出色，轻松拍出高质量照片。
19154189291,2023-05-28 05:53:00,🟊🟊🟊🟊🟊,外形外观：大小是我非常喜欢的，拿在手里刚好;屏幕音效：都不错 我又不是专业的 足够了;拍照效果：挺好的;运行速度：挺快的;待机时间：还行吧;其他特色：喜欢就好
19093946839,2023-05-08 19:47:46,🟊🟊🟊🟊🟊,iPhone有一点厚，现在这个手感拿起来比较重，。游戏运行也不错，其他都不错，真心评价，紫色款颜值很高，大爱。。。。。值得拥有。 京东发货和物流速度那是更快。拍照效果：很清晰的，今年的摄像头模组又大了很多。 显示效果：色彩很好，很柔和。电池续航：电池不错 运行速度：很快的， 通信音质：音质没毛病，底下堵住听筒那边就响声环绕，立体声很好！
19156998136,2023-05-28 20:21:43,🟊🟊🟊🟊🟊,外形外观：外观好看，给十分;屏幕音效：显示细腻非常好;拍照效果：贵在真实，拍出来也好看;运行速度：苹果最新处理器，没的说;待机时间：还可以
19092158642,2023-05-08 09:45:49,🟊🟊🟊🟊🟊,外形外观：苹果的外观设计一直都戳中我的审美，简约精致;屏幕音效：屏幕完美，自适应刷新屏幕，刷新率更高的同时，更加省点。;拍照效果：拍照效果也是第一梯队，4800万像素没的说，拍照视频丝滑流畅;运行速度：A16处理器毋庸置疑，第一梯队产品，流畅运行;待机时间：之前用的mini，续航还行，用上新款14Pro续航更顶，再上一个台阶。;其他特色：购物体验非常棒，黑色很喜欢，爱了爱了
19160370058,2023-05-29 20:15:16,🟊🟊🟊🟊🟊,外形外观：美观大气;屏幕音效：非常好，特别好;拍照效果：很好看，堪比专业的;运行速度：运行速度：运行速度 很快;待机时间：正常待机，新手机都很好用的
19149997778,2023-05-26 20:15:47,🟊🟊🟊🟊🟊,外形外观：时尚大方。手感特别好。;屏幕音效：音效比上一代强了很多。音质提升了不是一点点;拍照效果：拍照加速ai元素。确实比以前提升了很多。;运行速度：运行速度就不用说了。贼快。;待机时间：待机时长长。;其他特色：信号比以前的版本好不少。赶紧出15我要换了。
19169151542,2023-06-01 11:15:49,🟊🟊🟊🟊🟊,京东服务就是好，昨天晚上下单今天早上就收到货了，品质服务值得信赖，买东西一直选择京东，就是看中服务和送货速度！还有遇到活动力度也很大，特别划算！
19148451328,2023-05-26 12:17:28,🟊🟊🟊🟊🟊,外形外观：银色款比我想象中的要好看很多;屏幕音效：屏幕顺滑，音效一如既往;拍照效果：升级了4800，还是不错的;其他特色：切换流畅
19132608214,2023-05-21 15:53:31,🟊🟊🟊🟊🟊,用起来超级顺，手感细腻舒适，触屏的时候特别舒服，反应也非常的灵敏，抗指纹效果那是非常的赞，膜的质感很强，非常好看，拿在手里明显感觉很有档次。而且贴膜的容易度，也是so easy的，我是自己搞定的，完全没有费力，用了之后会发现，屏幕的洁净度比别的膜要好很多，整体非常的满意。
19164875047,2023-05-31 09:12:10,🟊🟊🟊🟊🟊,手机是送给老婆的，女的用颜值很高，很漂亮，唯独就是女生用有点大，这个纯属看个人喜好。手机表面摸起来很丝滑，运行也不卡，电量很耐用，总之很好
19152377681,2023-05-27 15:01:38,🟊🟊🟊🟊🟊,京东618活动买的，非常划算，外观颜值很高，手机手感一流，4800W像素效果提升非常明显，比以前的更清晰了，ios系统运行速度非常流畅，无卡顿感觉，玩游戏爽呆了，非常的丝滑流畅，续航也很顶，充满电用一天没问题。
19144118413,2023-05-25 05:56:21,🟊🟊🟊🟊🟊,外形外观：颜值超高，特别满意，新功能很喜欢&hellip;&hellip;;屏幕音效：音质很好&hellip;&hellip;;拍照效果：超级无敌棒&hellip;&hellip;;运行速度：一如既往的快&hellip;&hellip;;待机时间：满意&hellip;&hellip;;其他特色：京东物流超级给力，很满意的一次购物&hellip;&hellip;
19165299917,2023-05-31 11:11:21,🟊🟊🟊🟊🟊,外形外观：好看好看好看;屏幕音效：音质很好;拍照效果：拍照清晰;运行速度：很流畅不卡顿不愧是苹果旗舰机;待机时间：电池续航很好;其他特色：颜值高
19176905715,2023-06-03 00:16:48,🟊🟊🟊🟊🟊,外形外观：外观漂亮大气，银色洁白如玉，很好看;屏幕音效：音效很棒;拍照效果：苹果原相机，懂得都懂;运行速度：运行相当流程，速度也很快
19156362359,2023-05-28 17:58:15,🟊🟊🟊🟊🟊,外形外观：非常高级，黑色yyds，很耐看质感非常好;屏幕音效：三星屏，比12提高了很大的档次;拍照效果：很高清;待机时间：安全下车，电池续航也很不错
19184726156,2023-06-04 18:38:30,🟊🟊🟊🟊🟊,外形外观：时尚好看;屏幕音效：很好;拍照效果：视频录制最好;运行速度：很快;待机时间：新手机就是耐用;其他特色：老婆喜欢 无理由买
19175800632,2023-06-02 19:38:33,🟊🟊🟊🟊🟊,京东自营值得信赖，物流业特别快，应该是全新的，用着还不错;外形外观：好看;屏幕音效：好用;拍照效果：特别清楚;运行速度：流畅;待机时间：一天够用
19166688536,2023-05-31 18:20:20,🟊🟊🟊🟊🟊,手机很好，用着不错。好评;外形外观：好看;屏幕音效：音质好;拍照效果：拍照好;运行速度：速度快;待机时间：时间长;其他特色：好
19160745304,2023-05-29 22:01:11,🟊🟊🟊🟊🟊,外形外观：很大气，颜色很好看，超级喜欢;屏幕音效：声音不错的;拍照效果：清晰度很高，很清楚;运行速度：速度杠杠的，毕竟是新手机;待机时间：不完游戏一天不用充电的，省电;其他特色：用了背后有点发烫，感觉不是很好，后期用了在发现吧，整体还不错的
19109944232,2023-05-14 11:01:05,🟊🟊🟊🟊🟊,外形外观：好看;屏幕音效：优秀;拍照效果：优秀;运行速度：非常流畅;待机时间：一般就一天;其他特色：摄像效果好评
19115644217,2023-05-16 08:19:12,🟊🟊🟊🟊🟊,外形外观：是我喜欢的颜色;屏幕音效：还可以;拍照效果：很清晰，颜色好看。;运行速度：很快，;待机时间：一天一充。
19149431369,2023-05-26 17:21:47,🟊🟊🟊🟊🟊,香喷喷的新手机。用券购买，价格优惠，真香！;外形外观：很大气，一手不能握;屏幕音效：音效音质很好，看电影、听音乐都是享受;拍照效果：拍照清晰;运行速度：运行速度很流畅，使用不卡壳
19179909699,2023-06-03 17:51:46,🟊🟊🟊🟊🟊,第一次用苹果，已经用了一两天，是正品，用着很流畅，灵动岛也很好用，特别是相机，女孩子买苹果的大部分原因都是拍照好看吧，原相机拍出来一点都不黄，黑色也很高级，这两天很开心哈哈哈哈
19149940325,2023-05-26 19:58:38,🟊🟊🟊🟊🟊,外形外观：收到货，第一时间拆包装，质量非常好，与卖家描述一致，完全超出我的期望值，包装很仔细、严实，总的来说这次是很满意的一次购物，感谢卖家。;拍照效果：正品，质量好，价格低，性比价高，物美价廉，物有所值，朋友看了都说好。客服服务热情都到。物流很给力;运行速度：包装很好，快递给力，卖家很有信誉，发货速度也很快。价格更是比别家的实惠多了;待机时间：质量非常好，与卖家描述的完全一致，完全超出期望值，包装非常仔细，很满意的一次购物;其他特色：不好意思评价晚了，非常好的店家，东西很喜欢！买来这个是送人的，她很喜欢
19153674351,2023-05-27 21:46:17,🟊🟊🟊🟊🟊,"经典设计直角边框，手感非常好,不硌手,握持感好,不锈钢边框很有质感屏幕音效: iPhone屏幕一如既往的优秀项级显示效果拍照效果:加大的摄像头模组拍照更优秀了,新加入的运动模式，防抖再次领先行业运行速度: iPhone每次上新都是天花板级别的存在,这次iPhone14Pro当然也不例外待机时间:充满电出门,一天下来不用冲，现在苹果的续航确实优化的很可以"
19181157006,2023-06-03 22:24:21,🟊🟊🟊🟊🟊,外形外观：外观无瑕疵，非常漂亮机器。;屏幕音效：屏幕显示在手机里面也算是顶级了吧。;拍照效果：拍照效果非常不错。画面很细腻，很有真实感。;运行速度：运行速度的确很好，不卡。苹果系统很不错的。;待机时间：待机轻度使用一天没问题。;其他特色：非常满意。
19158314181,2023-05-29 10:22:02,🟊🟊🟊🟊🟊,外形外观：黑色看起来还是非常有质感的，拿在手里也有分量;屏幕音效：屏幕效果色彩啥的都不错，颜色很正，音效听歌什么的完全可以满足了;拍照效果：拍照优化的一如既往的好，功能现在也越来越多了;运行速度：一直被大家夸赞的运行速度还是水准之上的，很丝滑，手感很好
19165326577,2023-05-31 11:20:34,🟊🟊🟊🟊🟊,外形外观：真的很好，性价比也很高，质量也很好，物流也快啊！一天就到货了！;屏幕音效：商品符合描述，主要是活动便宜，能省很多钱;拍照效果：(?&bull;??&bull;?)??价格超优惠，性能也非常棒，完美的一次购物;运行速度：包装很完美，颜值很高，感觉物超所值！客服也非常耐心细致，发货快物流给力，以后还会再来??
19132130124,2023-05-21 13:14:51,🟊🟊🟊🟊🟊,用起来很不错非常可以非常可以1.手机颜色好看，大气，拿在手上手感好，使用起来，速度挺快，大电量不用天天充电挺好。照相效果也挺好，带广角的，有景深感。买的高配，性价比高，希望多用段时间。
19167763069,2023-05-31 22:36:58,🟊🟊🟊🟊🟊,屏幕音效：赠送半年音乐会员就很棒;;待机时间：个人使用比较少，可以两天;;外形外观：很nice，很棒
19110623548,2023-05-14 14:55:26,🟊🟊🟊🟊🟊,256G够用了;优点：运输快捷、包装严实、做工精细、深空灰色很不错&hellip;;外形外观：靓;屏幕效果：靓;拍照效果：靓;运行速度：快;待机时间：长
19179309780,2023-06-03 15:45:22,🟊🟊🟊🟊🟊,不错不错，送货速度很快，;外形外观：漂亮;拍照效果：很不错;运行速度：流畅;总之，使用起来感觉也是非常不错的，趁618活动拿下
19162106358,2023-05-30 11:45:45,🟊🟊🟊🟊🟊,"续航目前还可以，手感挺不错的，上手之后ios系统很流畅,高刷很丝滑，信号目前还行，拍照近距离聚好，这次也升级到了4800w,视频增加了防抖功能。现在pro系列手感更好，日常用更舒服。银色真的很惊艳很好看，这一代的银色真的很票亮，屏幕色彩表现相之前的系列更舒服。灵动岛提升了实用性，设计的很酷很有趣。"
19149201783,2023-05-26 16:14:02,🟊🟊🟊🟊🟊,手机大小刚刚好，手感不错，外观很漂亮，各项功能都很好，尤其拍照超清晰，拍的快充套装，充电速度快，唯一不好的就是买了两周，降价200元，7天的价保过了
19183214471,2023-06-04 13:16:33,🟊🟊🟊🟊🟊,质感一级棒;外形外观：丝丝滑滑感觉很有质感不愧是pro;屏幕音效：没的说比杜比音效都强;拍照效果：超级高清不需要任何美颜太真实身临其境;运行速度：A16不是吹的还是苹果芯片香已经是第三台了入手从11用到14，果断的果粉;待机时间：超长待机吊打安卓机;其他特色：整体9.9，接近满分，一分价钱一分货不虚啊顶用顶摔
19177485199,2023-06-03 09:12:35,🟊🟊🟊🟊🟊,外观和质量都挺好，一如既往的漂亮和精致;屏幕音效，P3级别，超级清晰，颜色又正拍照效果，出;片一如既往的稳又不花里胡哨，运行速度快，特别快，应;用秒开，很不错
19182259888,2023-06-04 10:00:06,🟊🟊🟊🟊🟊,安全下车咯，手感超级好哈哈哈哈哈哈，一直在纠结是pro还是pm，最终还是决定pro，手感一绝，续航的话对我来说是可以了，不怎么打游戏，还有高刷真的爽，然后这个黑色太好看啦，只是用的12绿色，看到同学用的黑色我就觉得黑色超级好看，这次果断黑色欧耶耶！
19110728947,2023-05-14 15:34:55,🟊🟊🟊🟊🟊,外形外观：外形近乎完美;手感用起来比之前的13好;拍照效果：拍照效果非常清晰，而且有最高模式拍照加强
19151531077,2023-05-27 10:39:53,🟊🟊🟊🟊🟊,外形外观：外形中规中矩，丝滑流畅;屏幕音效：扬声器播放音质效果很好;拍照效果：清晰，图片品质很好;运行速度：运行流畅;待机时间：能保证我一天使用;其他特色：买来给媳妇使用，赶上活动还是感觉赚到了，一如既往的好评，相信官方渠道品质
19160716532,2023-05-29 21:54:07,🟊🟊🟊🟊🟊,外观设计风格很大气，好看，像素也很清晰，价格也很合适，用着新手机感觉就是不一样，;拍照效果：超级好，清晰度很高;运行速度：很快;待机时间：不玩游戏下一天不用充电?;其他特色：分辨度高
19167352996,2023-05-31 21:06:05,🟊🟊🟊🟊🟊,苹果手机收到了，包装完好无损，发货速度;很快。手机使用效果不错，拍照清晰，系统更;新流畅，运行内存足够。玩了好一会游戏，还有;充足电量，整体符合预期。
19158946862,2023-05-29 13:18:32,🟊🟊🟊🟊🟊,外形外观：6.1英寸 非常奈斯;屏幕音效：扬声器很棒，声音清楚;拍照效果：4800万像素很清楚;运行速度：8gb nife;待机时间：续航还不错的;其他特色：京东物流很快，是第二次回购了哈哈哈，大赞
19137199800,2023-05-22 23:12:39,🟊🟊🟊🟊🟊,外形外观：做工精良，大小合适;屏幕音效：触感灵敏;拍照效果：拍照效果感觉也很好;运行速度：流畅;待机时间：充电速度挺快，期待续航长
19164127964,2023-05-30 22:10:23,🟊🟊🟊🟊🟊,外形外观：水滴屏效果不错，体验很好。终于用上了。;屏幕音效：双扬声器效果就是好。;拍照效果：不愧是苹果最新的相机，效果很好;运行速度：最新芯片无敌;待机时间：一条两充，重度使用。
19172145940,2023-06-01 23:02:10,🟊🟊🟊🟊🟊,外形外观：好看的很;屏幕音效：显示非常细腻;拍照效果：很好;运行速度：非常快;待机时间：一天没问题;其他特色：挺好的
19175396178,2023-06-02 18:10:41,🟊🟊🟊🟊🟊,很好很满意，618活动很给力，给家里人都换了新手机，自己用一般的可以，父母用好的，不用杀毒，不自动安装软件，拍照功能也好，声音大，屏幕清楚，长辈拿出去拍花花草草也很好
19141411302,2023-05-24 11:08:36,🟊🟊🟊🟊🟊,外形外观：紫色低调又奢华;屏幕音效：立体声带劲;拍照效果：三摄很厉害;运行速度：十分快十分流畅值得这个价格;待机时间：一天两充，续航十分满意
19170836107,2023-06-01 18:10:56,🟊🟊🟊🟊🟊,大小，正好适合女生阳光下，亮度很高，非常清晰，扬声器够用，比11好太多了，特别是长江后面高刷一用就回不去了，真流畅
19164272358,2023-05-30 22:59:32,🟊🟊🟊🟊🟊,九小时内到达 发货很快 安全下车;外形外观：很好 是全新 满意;屏幕音效：很好 满意;拍照效果：很流畅 满意;运行速度：很流畅 满意
19171154043,2023-06-01 19:23:02,🟊🟊🟊🟊🟊,发货超级快，上午下单，下午就收到货了，买给男友的生日礼物，男朋友很喜欢。;黑色很好看，pro磨砂的质感很好，很高级，手感也超棒。;使用体验也很好?
19175514204,2023-06-02 18:38:05,🟊🟊🟊🟊🟊,外形外观：很有质感，比普通版耐看多了;屏幕音效：屏幕的高刷真的很舒服，太丝滑了～;拍照效果：12换过来的，拍照提升太大了，长焦真的好用！
19114320018,2023-05-15 18:10:37,🟊🟊🟊🟊🟊,外形外观：非常好看银色的外观很好看;屏幕音效：很丝滑音效ok;拍照效果：4800万像素摄像头很不错;待机时间：3200mAh也够用了
19185589311,2023-06-04 21:37:11,🟊🟊🟊🟊🟊,外形大气上档次，大小合适有质感，屏幕占比高，音质浑厚，拍照特别给力，夜景也很出彩，电池容量虽不是特别高，但续航是真的顶。
19165690668,2023-05-31 13:08:27,🟊🟊🟊🟊🟊,我最爱的苹果?运行起来十分流畅，系统及各方面的设置都突出一个简约干净!这代在拍照方面也非常出色!机子从内而外没有任何问题，日常使用一天一充非常高!而外观相较于老机型这次很漂亮，只是目前灵动岛功能感觉可有可无，作用不大，权当一个挖孔屏对待，所以可忽略。因为仅用来日常使用，本次购物体验方面无论是发货速度，还是派送速度都很快，客服的服务态度也很赞!机子隔一晚上就收到了，总之，真的非常满意诶!是一次相当顺心愉快的购物体验!
19173623312,2023-06-02 11:37:27,🟊🟊🟊🟊🟊,7299拿下，哈哈哈哈，价格还行，各种百亿补贴虽然便宜，不敢买，这个放心，第二天就到啦，安全下车没有瑕疵可以放心购买。还能分期，喜欢，信号也很好啊，之前手机没有信号的地方，现在都有了！
19157699007,2023-05-29 01:53:28,🟊🟊🟊🟊🟊,它的屏幕素质相比上一代提升了很多，还是一块6.1英寸超视网膜XDR显示屏，但是分辨率达到了2556*1179像素，460ppi像素密度，显示效果非常清晰，它最高峰值亮度可达2000尼特，也就说阳光照射下也可以看清楚屏幕，达到了业内的顶级水准。
19141633979,2023-05-24 12:16:28,🟊🟊🟊🟊🟊,14pro果然没让人失望，操作起来很顺滑。手感很不错，拍照效果对比之前的机子，确实提升了很大档次，拍出来的照片非常清晰?;拍照效果：很赞;运行速度：快
19170132875,2023-06-01 15:23:22,🟊🟊🟊🟊🟊,外形外观：外观就不用说了 新出的紫色当然是极品啦;屏幕音效：屏幕高刷的 很舒服;拍照效果：拍照4800像素清楚了很多;运行速度：A16芯片很快;待机时间：待机时间挺长的，买来用了半天了还没充过电;其他特色：基本没有啥问题，外观不错。
19110574240,2023-05-14 14:39:04,🟊🟊🟊🟊🟊,外形外观：外观完美，黑色大气上档次;屏幕音效：屏幕大小刚好，音效完美;拍照效果：拍照效果好;运行速度：运行速度快
19159754956,2023-05-29 17:18:25,🟊🟊🟊🟊🟊,关注很久了，趁着这次活动赶紧入手一部，很喜欢金色的，大小合适手感好。;外形外观：漂亮 大气;屏幕音效：清晰 音效很好
19167556147,2023-05-31 21:51:17,🟊🟊🟊🟊🟊,外形外观：看着方方正正的，很舒服;运行速度：速度刚刚的;屏幕音效：声音很棒，感觉像立体的;待机时间：挺耐用的，一天不用，基本上电是满的
19176869822,2023-06-03 00:02:53,🟊🟊🟊🟊🟊,通信音质：有感觉用起来还不错哟，以前不太用苹果手机，没有习惯，现在感觉5G手机非常快，拍照效果非常好显示效果：显示屏非常好的喔，而且圆滑的感觉，自带的显示屏，原装的就是比其他的好其他特色：感觉语音，拍照技术，网速快，传输速度快，网络速度快
19171069132,2023-06-01 19:02:55,🟊🟊🟊🟊🟊,手机买了一个多月了，这段时间使用下来没出现任何问题。颜色选的是黑色，虽然第一眼没有很惊艳，但却很耐看。运行速度也很快，4800万像素拍照很牛！总之选14pro没有错。
19138730230,2023-05-23 14:26:48,🟊🟊🟊🟊🟊,外形外观：黑色还是那么经典好看;屏幕音效：依旧那么出色;拍照效果：4800w像素的确厉害;运行速度：非常流畅;待机时间：目前来说还行;其他特色：新的灵动岛很新奇
19166008430,2023-05-31 14:53:07,🟊🟊🟊🟊🟊,拍照效果：拍照效果特别棒，从12 pro换换过来的，12的摄像头很小，拍照没有这个好。;运行速度：速度很快，旗舰手机该有的;屏幕音效：屏幕效果提升了很多，续航能力也提高了很多
19176852944,2023-06-02 23:51:44,🟊🟊🟊🟊🟊,外形外观：大气，一看就是有钱人用的手机，哈哈。;屏幕音效：苹果音质就是比安卓抢一万倍。;拍照效果：拍照扫码那简直是最有效率的。;运行速度：流畅丝滑，毫无卡顿。;待机时间：苹果电池也是很耐用的。
19144820458,2023-05-25 11:10:26,🟊🟊🟊🟊🟊,苹果14pro真的太绝了，流畅好用，拍照也超级清晰，特别喜欢上面的灵动岛，看直播或者听歌，上面就会显示出来，音质也很好，非常流畅
19164559955,2023-05-31 05:46:51,🟊🟊🟊🟊🟊,正品，送货快包装严实，第一次用苹果手机内心特别激动，打开后高端大气上档次，低调奢华有内涵，运行速度快，丝滑顺畅，拍照清晰，视频完美还原真实情况，真的是太棒了，这么多年一直用安卓.后悔没能早点用苹果，除了有点重，通话不能录音，刷完完美
19148356092,2023-05-26 11:46:28,🟊🟊🟊🟊🟊,这款苹果14Pro手机外形美观，颜值高，紫色很漂亮。手机拍摄效果佳，运行速度快，屏幕灵敏度好，画质清晰。
19176439094,2023-06-02 21:53:49,🟊🟊🟊🟊🟊,运行速度：苹果手机系统肯定没的说，系统流畅，运行速度杠杠的；;外形外观：依旧大气上档次，手感很舒服；;安全上岛，安全下车！
19170147882,2023-06-01 15:25:08,🟊🟊🟊🟊🟊,物流超级快 第二天中午就收到了 金色也很好看 淡淡的 妹妹很喜欢 各方面都很优秀 性能没得说 超级推荐
19174475814,2023-06-02 14:48:36,🟊🟊🟊🟊🟊,挺不错的商品完好;外形外观：完美;屏幕音效：声音正常;拍照效果：还可以 很好了;运行速度：特别快可以感受到特别好的速度 打游戏企业特别好感觉很不错;待机时间：一天没有问题可以一直用 特别好可以冲
19164553735,2023-05-31 05:13:49,🟊🟊🟊🟊🟊,手机非常好，苹果果然还是一如既往，送给客户也很棒，;外形外观：很不错;屏幕音效：也很好;拍照效果：自然不用多说了，看图拍照效果;运行速度：无比流畅
19150165748,2023-05-26 21:08:28,🟊🟊🟊🟊🟊,外观非常高端，不锈钢的边框，磨砂玻璃，大三眼，一如既往的大气，灵动岛配合a16处理器，简直不要太强，续航非常顶，使用一天完全没有任何压力，全新升级4800w像素提升巨大
19153952008,2023-05-27 23:34:10,🟊🟊🟊🟊🟊,手机性价比很高，特别满意，感觉京东真的很好，能让我买到这么好的产品，手机拍照效果很好运行速度很快，屏幕也很完美，音质特别的棒，非常喜欢非常满意！运行速度也很流畅，待机时间也不错！颜色也很正总之不错哟。
19152808051,2023-05-27 17:12:10,🟊🟊🟊🟊🟊,手机运行速度很快，京东有活动的时候也很便宜，物流比较快，之前都是用的苹果，这次换的第三个了，用的时间比较长，见有活动就换了一个。;外形外观：感觉白色百搭;屏幕音效：音效杠杠的;拍照效果：4800w的像素杠杠的;运行速度：很快
19165584452,2023-05-31 12:39:33,🟊🟊🟊🟊🟊,买了第二个了，安全下车，按照网上全程抽了开箱视频，没有任何问题州银色我直接爱住了，很有质感！而且物流也太给力了，下午下单第二天中午就收到货了，还是送货上门，特意来评价一波！己经用了一天了，先用着，后续有问题再来追评。
